{
  "schemaVersion": 1,
  "id": "product-management.requirements-quality",
  "title": "Requirements quality and ownership",
  "description": "Defines the mandatory minimum for the Product-owned build contract.",
  "ownerDomain": "product-management",
  "version": "1.0.0",
  "appliesTo": {
    "deliveryFlows": ["poc", "implementation", "pdlc"],
    "stages": ["requirements-clarification", "requirements-analysis", "acceptance-criteria-definition", "requirements-approval", "build-readiness"]
  },
  "rules": [
    {
      "id": "product-owns-behavior",
      "statement": "The Product role owns and explicitly approves product behavior, business rules, scope, success measures, and acceptance criteria before implementation.",
      "enforcement": "approval",
      "requiredEvidence": ["Approved product-management.requirements Artifact and content hash"],
      "exceptionApprovers": ["product-governance"]
    },
    {
      "id": "resolve-material-ambiguity",
      "statement": "Material open questions and contradictions must be resolved before Build Readiness passes.",
      "enforcement": "automatic",
      "exceptionApprovers": ["product-governance"]
    },
    {
      "id": "traceable-acceptance",
      "statement": "Acceptance criteria must be observable and traceable to the approved requirements and verification evidence.",
      "enforcement": "evidence",
      "requiredEvidence": ["Requirement-to-acceptance traceability"]
    }
  ]
}
